,Conversation,Sentiment,cleaned,Length
0,আমি বুথ থেকে কল দেয়ার জন্য দুঃখিত,negative,বুথ কল দেয়ার দুঃখিত,4
1,আমি তোমার সম্পর্কে দুঃখিত,negative,সম্পর্কে দুঃখিত,2
2,আমার ভয় হচ্ছিল আমি খুব ভয় পেয়েছিলাম,negative,ভয় হচ্ছিল ভয় পেয়েছিলাম,4
3,অবশ্যই ধন্যবাদ ,positive,অবশ্যই ধন্যবাদ,2
4,কী সুন্দর!! আমি খুব খুশি,positive,সুন্দর খুশি,2
5,আমিও তার জানাজায় ছিলাম,negative,আমিও জানাজায় ছিলাম,3
6,"আমি দুঃখিত, ভুলে যাচ্ছি আমি তোমাকে বলেছি",negative,দুঃখিত ভুলে যাচ্ছি বলেছি,4
7,আমার সমস্যা হচ্ছে আমি দুঃখিত,negative,সমস্যা দুঃখিত,2
8,দুঃখের সময় সামনে,negative,দুঃখের সময়,2
9,আমি তোমাকে ভালবাসি,positive,ভালবাসি,1
10,"দুর্দান্ত তুমি কি তাতে খুশি?  হ্যাঁ, আমি শিহরিত খুঁজে পেয়েছি!",positive,দুর্দান্ত খুশি হ্যাঁ শিহরিত খুঁজে পেয়েছি,6
11,আমি দুঃখিত কখনও কখনও এটি ঘটে,negative,দুঃখিত ঘটে,2
12,আমি দুঃখিত,negative,দুঃখিত,1
13,তোমাকে স্বাগতম ,positive,স্বাগতম,1
14,আমরা ব্রেক আপ করেছি,negative,ব্রেক আপ করেছি,3
15,"আমার শরীর নিয়ন্ত্রণ হারাতে শুরু করে
",negative,শরীর নিয়ন্ত্রণ হারাতে,3
16,আমার অবস্থা বর্ণনা করা কঠিন ছিল,negative,অবস্থা বর্ণনা কঠিন,3
17,আমিও সামলাতে পারিনি,negative,আমিও সামলাতে পারিনি,3
18,আমার ভবিষ্যতটি বিবর্ণ দেখাচ্ছে,negative,ভবিষ্যতটি বিবর্ণ দেখাচ্ছে,3
19,এমনভাবে দেখানোর জন্য দুঃখিত,negative,এমনভাবে দেখানোর দুঃখিত,3
20,আমার অনেক পরিকল্পনা আছে ,positive,পরিকল্পনা,1
21,আমরা দুজনেই বিবাহিত হতে পারি,positive,দুজনেই বিবাহিত,2
22,আমি আশা করি তুমি খুশি হবেন,positive,আশা খুশি,2
23,আমি যা করেছি তা ভয়ানক ছিল,negative,করেছি ভয়ানক,2
24,আমি থাকতে পারছিলাম না,negative,থাকতে পারছিলাম,2
25,সে আমার সম্পর্কে ভুলে যেতে চায়,negative,সম্পর্কে ভুলে,2
26,তোমার দৃঢ় প্রত্যয় আমাকে অভিভূত করেছিল,positive,দৃঢ় প্রত্যয় অভিভূত করেছিল,4
27,শেষ পর্যন্ত আমাদের বিয়ে হয়ে গেল,positive,শেষ বিয়ে,2
28,আমি খুব শান্তি পাচ্ছি,positive,শান্তি পাচ্ছি,2
29,শুভ সকাল,positive,শুভ সকাল,2
30,এখানে ফুল দিয়ে পূর্ণ হলে এই বাগানটি খুব সুন্দর হবে,positive,ফুল পূর্ণ বাগানটি সুন্দর,4
31,তুমি খুব কষ্ট করতেছো,negative,কষ্ট করতেছো,2
32,বর্ষাকাল শেষ হবে,positive,বর্ষাকাল শেষ,2
33,আমি নিশ্চিত তারা তাকে নিতে আসবে,positive,নিশ্চিত আসবে,2
34,আমরা সময়গুলি ভালভাবেই উপভোগ করেছি,positive,সময়গুলি ভালভাবেই উপভোগ করেছি,4
35,আমি দুঃখিত আমি আপনাকে ভয় পাইয়ে দিয়েছি,negative,দুঃখিত ভয় পাইয়ে দিয়েছি,4
36,আমি দুঃখিত,negative,দুঃখিত,1
37,এটি সত্যিই একটি দীর্ঘ গল্প ,positive,সত্যিই দীর্ঘ গল্প,3
38,আমি তাদের সম্পর্কে উদ্বিগ্ন,negative,সম্পর্কে উদ্বিগ্ন,2
39,আমি সত্যিই আপনার সাথে কথা বলছি,positive,সত্যিই বলছি,2
40,আমাকে আপনার সম্পর্কে বলেছে,positive,সম্পর্কে বলেছে,2
41,শুভ জন্মদিন ,positive,শুভ জন্মদিন,2
42,কি দারুন!,positive,দারুন,1
43,আমি আজ এটি উদযাপন করতে চাই,positive,উদযাপন চাই,2
44,আমার একটু ভয় হচ্ছে,negative,একটু ভয়,2
45,আমি তোমায় ভালোবাসি,positive,তোমায় ভালোবাসি,2
46,আমাকে বিদায় জানাতে হবে,negative,বিদায় জানাতে,2
47,"আমি দুঃখিত, মা",negative,দুঃখিত,1
48,"তুমি মারা গেছো এটা আমার দোষ, তাই না?",negative,মারা গেছো দোষ,3
49,তুমি অনেক বোকা,positive,বোকা,1
50,তুমি আমাদের সুখ এনে দিয়েছো,positive,সুখ এনে দিয়েছো,3
51,তুমি আমাকে খুব খুশি করেছো,positive,খুশি করেছো,2
52,"বড় হয়ে ওঠো চমৎকার মানুষ হিসেবে, ঠিক আছে?",positive,বড় ওঠো চমৎকার মানুষ হিসেবে,5
53,"তুমি পেরেছো, আমি খুশি",positive,পেরেছো খুশি,2
54,আমি খুব খুশি ছিলাম,positive,খুশি ছিলাম,2
55,আমি সবসময় খুশি ছিলাম,positive,সবসময় খুশি ছিলাম,3
56,তুমিই ছিলে আমার সুখ,positive,তুমিই ছিলে সুখ,3
57,"তোমার সাথে থাকাই আমার সব খুশি ছিল
",positive,থাকাই খুশি,2
58, ঠান্ডা লাগছে,negative,ঠান্ডা লাগছে,2
59,আমি সবসময় তোমার পাশে থাকা স্বাচ্ছন্দ্যবোধ করি,positive,সবসময় পাশে স্বাচ্ছন্দ্যবোধ,3
60,মা! খুঁজে পেয়েছি!,positive,খুঁজে পেয়েছি,2
61,সে বৃষ্টির সাথে এসে বৃষ্টির সাথে চলে গেল,positive,বৃষ্টির বৃষ্টির,2
62,"ডাক্তার, তুমি কি সত্যই আমাকে বিশ্বাস কর?",positive,ডাক্তার সত্যই বিশ্বাস কর,4
63,আবারও প্রেমে পড়ে গেলাম,positive,আবারও প্রেমে পড়ে গেলাম,4
64,আমি খুব খুশি ছিলাম,positive,খুশি ছিলাম,2
65,আমি অবাক হই এই পৃথিবীতে কত লোক,positive,অবাক হই পৃথিবীতে লোক,4
66,তারপরে আবার একসাথে ফিরে যেতে পেরেছে?,positive,তারপরে একসাথে পেরেছে,3
67,তোমরা দুজনেই দেখা করার জন্য যথেষ্ট ভাগ্যবান ছিলে,positive,তোমরা দুজনেই ভাগ্যবান ছিলে,4
68,আমি এমন কাউকে পেয়েছি যাকে ছাড়া কিছু ভাবতে পারি না,positive,পেয়েছি ছাড়া ভাবতে,3
69,"আমি আশ্চর্য হবো, যদি আমি প্রেমে পড়ে যাই",positive,আশ্চর্য হবো প্রেমে পড়ে যাই,5
70,আমার মনে হয় যে আমি তার প্রেমে পড়েছি,positive,প্রেমে পড়েছি,2
71,আমি কেবল তার পাশে বসে খুশি,positive,কেবল পাশে খুশি,3
72,এটি আমাকে সুখী করার পক্ষে যথেষ্ট,positive,সুখী,1
73,আমি তোমাকে জানতে চাই,positive,চাই,1
74,তুমি কোন বই পড়ছো?,positive,বই পড়ছো,2
75,তুমি কি ধরনের গান পছন্দ করো?,positive,ধরনের গান পছন্দ,3
76,তোমার প্রিয় রং কি কি?,positive,প্রিয় রং,2
77,তুমি কি ধরনের মেয়েদের পছন্দ করো?,positive,ধরনের মেয়েদের পছন্দ,3
78,আমি তাকে ফোন করতে পারলাম এটি ফিরিয়ে দিতে,positive,ফোন পারলাম ফিরিয়ে,3
79,আমি তাকে ফোন করব,positive,ফোন করব,2
80,আমি সাহস পাইনি,negative,সাহস পাইনি,2
81,আমি তোমার মূল্যবান কলম সম্পর্কে দুঃখিত,negative,মূল্যবান কলম সম্পর্কে দুঃখিত,4
82,এই কলম আনন্দ এনে দিয়েছে,positive,কলম আনন্দ এনে দিয়েছে,4
83,"অনেকদিন হয়ে গেল, তুমি কেমন আছো?",positive,অনেকদিন কেমন আছো,3
84,তোমার কাছে এক কাপ কফি খাওয়ার জন্য সময় আছে?,positive,এক কাপ কফি খাওয়ার সময়,5
85,আমি কথা বলতে পারছিলাম না,negative,পারছিলাম,1
86,তবে আমি খুব খুশি ছিলাম,positive,খুশি ছিলাম,2
87,আমি আশা করি এটি যেন চিরকাল স্থায়ী হয়,positive,আশা চিরকাল স্থায়ী,3
88,"তবে বসন্তে, তুমি আমাকে একটি চিঠি লিখেছিলে",positive,বসন্তে চিঠি লিখেছিলে,3
89,আমরা উভয়ই বিবাহিত থাকতে পারি আলাদাভাবে,positive,উভয়ই বিবাহিত থাকতে আলাদাভাবে,4
90,আমি আশা করি তুমি খুশি থাকবে,positive,আশা খুশি,2
91,কিন্ত আমার একমাত্র সুখ তো তোমার পাশে রয়েছে,positive,কিন্ত একমাত্র সুখ পাশে,4
92,আমি তোমাকে দেখতে চাই,positive,চাই,1
93,আমি সহ্য করতে পারি না,negative,সহ্য,1
94,প্রেমে পড়েছি এবং ভালবেসেছি,positive,প্রেমে পড়েছি ভালবেসেছি,3
95,আমি ভবিষ্যত ভ্রমণ করেছি,positive,ভবিষ্যত ভ্রমণ করেছি,3
96,আমি আনন্দিত ছিলাম,positive,আনন্দিত ছিলাম,2
97,আমি সুখী জীবন যাপন করেছিলাম,positive,সুখী জীবন যাপন করেছিলাম,4
98,তারপর আমি বুঝলাম,positive,বুঝলাম,1
99,আমি মারা যাব,negative,মারা যাব,2
100,আমি প্রতিজ্ঞা করব পরের বর্ষায় ফিরে আসতে,positive,প্রতিজ্ঞা করব পরের বর্ষায় আসতে,5
101,তুমি এবং আমি সর্বদা একসাথে থাকব,positive,সর্বদা একসাথে থাকব,3
102,আপনার রেসিপি পছন্দ হয়েছে,positive,রেসিপি পছন্দ হয়েছে,3
103,তুমি কি আবার লম্বা হয়েছ?,positive,লম্বা হয়েছ,2
104,আমি বৃত্তি পেয়েছি,positive,বৃত্তি পেয়েছি,2
105,সোজাসুজি এদিকেই আসছে।,positive,সোজাসুজি এদিকেই আসছে,3
106,এসব কি করছেন?,negative,এসব,1
107,মুখ বন্ধ রাখুন।,negative,মুখ বন্ধ রাখুন,3
108,প্রত্যেকটা আঘাতের বদলে দ্বিগুন আঘাত ফেরত দেওয়া হবে,negative,প্রত্যেকটা আঘাতের দ্বিগুন আঘাত ফেরত,5
109,মাথা কেটে সবগুলোকে মুক্তি দেওয়া হবে,negative,মাথা কেটে সবগুলোকে মুক্তি,4
110,"রক্ত আমার বয়েছে, আপনার নয়",negative,রক্ত বয়েছে,2
111,যে এই মাটিতে লাল রঙের পতাকা উড়াবে,positive,মাটিতে লাল রঙের পতাকা উড়াবে,5
112,ভয় পেয় না,negative,ভয় পেয়,2
113,গতকাল তিনজনকে হত্যা করা হয়েছে,negative,গতকাল তিনজনকে হত্যা হয়েছে,4
114,আমার কাছে যা ছিল সব ভাগ করে দিয়েছি।,positive,ভাগ দিয়েছি,2
115,মহিলা আর বাচ্চাদের উপরে নির্যাতন করা হয়েছে,negative,মহিলা বাচ্চাদের নির্যাতন হয়েছে,4
116,আশ্রয় পাওয়ার মত তাদের কোন জায়গা নেই,negative,আশ্রয় পাওয়ার মত জায়গা,4
117,"তুমি চিন্তা কর না, একটা সমাধান খুঁজে বের করব",positive,চিন্তা কর সমাধান খুঁজে বের করব,6
118,তাদের খুন করা ছাড়া অন্য কোন পথ নেই,negative,খুন ছাড়া পথ,3
119,"যারা সত্য কথা বলবে, তাদেরই খুন করা হবে।",negative,সত্য বলবে তাদেরই খুন,4
120,চোখে দেখতে পান না?,negative,চোখে পান,2
121,সেটা কিভাবে সম্ভব?,positive,কিভাবে সম্ভব,2
122,তোর বোন মারা যাবে।,negative,তোর বোন মারা,3
123,মা কাঁদছে।,negative,কাঁদছে,1
124,আপনি আসুন।,positive,আসুন,1
125,তাদের কাছে কোন টাকা নেই। হাতে থাকা সবকিছু শেষ হয়ে গেছে।,negative,টাকা হাতে সবকিছু শেষ,4
126,তার বোন মারা গেছে।,negative,বোন মারা,2
127,"স্যার, রোদে বাইরে থাকবেন না, কালো হয়ে যাবেন।",positive,স্যার রোদে বাইরে কালো যাবেন,5
128,তার চাকরি ছেড়ে আরেকটা পেতে কষ্ট হচ্ছে।,negative,চাকরি ছেড়ে আরেকটা পেতে কষ্ট,5
129,আপনার ফোন বাজছে।,positive,ফোন বাজছে,2
130,ওখানে দাঁড়িয়ে আছে,positive,দাঁড়িয়ে,1
131,দূরে গিয়ে সিগারেট খাও,negative,দূরে সিগারেট খাও,3
132,কিন্তু বাস্তব পরিস্থিতিতে সেটা ভিন্ন।,positive,বাস্তব পরিস্থিতিতে ভিন্ন,3
133,আসলে এখানে সবচেয়ে বড় ভুক্তভোগী আমরাই,negative,আসলে সবচেয়ে বড় ভুক্তভোগী আমরাই,5
134,মুখ সামলাও। সম্মান দিয়ে কথা বল।,negative,মুখ সামলাও সম্মান দিয়ে বল,5
135,সেসবের সাথে এর কোন সম্পর্ক নেই।,positive,সেসবের সম্পর্ক,2
136,পুরো শহর রক্তে ভেসে গেছে,negative,পুরো শহর রক্তে ভেসে,4
137,আমরা রক্তের বদলে রক্ত নিব,negative,রক্তের রক্ত নিব,3
138,রক্তের বদলা নিয়ে ছাড়বো,negative,রক্তের বদলা ছাড়বো,3
139,নানারকম স্বাস্থ্য সমস্যা আর তাছাড়া কালকে পা কেটে গেছে,negative,নানারকম স্বাস্থ্য সমস্যা তাছাড়া কালকে পা কেটে,7
140,তাঁকে ছাড়ে দাও। শেষ করে দেবে তোমাকে।,negative,ছাড়ে দাও শেষ দেবে,4
141,"টাকা বের কর, নইলে তুই শেষ!",negative,টাকা বের কর নইলে তুই শেষ,6
142,দিব থাপ্পড়।,negative,দিব থাপ্পড়,2
143,বাজে কথা বলছেন কেন?,negative,বাজে বলছেন,2
144,বাজে কথা বললে তুই কি করবি? জলদি টাকা বের কর!,negative,বাজে বললে তুই করবি জলদি টাকা বের কর,8
145,এই ছোট ব্যাপারে টাকা কেন?,negative,ছোট টাকা,2
146,তোমার মা কোথায়?,positive,কোথায়,1
147,"উনার রক্তে সুগার বেড়ে গেছে, আরো কিছু সমস্যার জন্য হাসপাতালে আছে।",negative,উনার রক্তে সুগার বেড়ে আরো সমস্যার হাসপাতালে,7
148,কেউ কি ফোন করেছিল?,positive,ফোন করেছিল,2
149,তোমার সব বিষয়গুলো জানি আমি।,positive,বিষয়গুলো জানি,2
150,আমরা স্বামী-স্ত্রী এখনো একে অপরকে ভালবাসি,positive,স্বামী স্ত্রী এখনো অপরকে ভালবাসি,5
151,"আমার হিরো, আমার জন্য সে একাই একশ",positive,হিরো একাই একশ,3
152,আমার স্বামী আমার সবচেয়ে প্রিয় মানুষ।,positive,স্বামী সবচেয়ে প্রিয় মানুষ,4
153,"এখানে এসে জানতে পারলাম, এখানকার সবাই কাপুরুষ।",positive,পারলাম এখানকার সবাই কাপুরুষ,4
154,তখন থেকে আমার ভয় করছে।,negative,ভয়,1
155,"তিন-চার দিন আগে, চারজন লোক এসে হুমকি দিয়ে গেছে।",negative,তিন চারজন লোক হুমকি দিয়ে,5
156,আমি আর বাচ্চারা ঘরছাড়া হয়ে যাব,negative,বাচ্চারা ঘরছাড়া যাব,3
157,তুমি চুপ থাকো।,negative,চুপ থাকো,2
158,দেখে নিব তোকে।,negative,নিব তোকে,2
159,এখানে থাকতে হলে অবশ্যই একজন ছেলে বন্ধু লাগবে।,positive,থাকতে অবশ্যই একজন ছেলে বন্ধু লাগবে,6
160,আমাকে আর আমার ছেলেকে মেরে ফেলবে।,negative,ছেলেকে মেরে ফেলবে,3
161,পাগল কে? কাকে পাগল বলছেন?,negative,পাগল কাকে পাগল বলছেন,4
162,বেশি সেয়ানাগিরি করছেন নাকি?,negative,সেয়ানাগিরি,1
163,"তাকে পরিচয় করিয়ে দিয়েন, যাতে কাজের সুযোগ পায়।",positive,পরিচয় করিয়ে দিয়েন কাজের সুযোগ পায়,6
164,"তুমি যাও, আমি তাকে দিয়ে দেব।",positive,যাও দিয়ে দেব,3
165,সব মুভি দেখতে আমাকে ও মেয়েকে নিয়ে যেত।,positive,মুভি মেয়েকে যেত,3
166,মারা যাওয়ার আগে বয়স ৭/৮ বছর ছিল। ছোট্ট অসহায় মেয়ে।,negative,মারা যাওয়ার বয়স ৭ ৮ বছর ছোট্ট অসহায় মেয়ে,9
167,রোগে মারা গিয়েছিল।,negative,রোগে মারা গিয়েছিল,3
168,আওয়াজ শুনে গায়ের লোম খাড়া হয়ে গিয়েছিল,negative,আওয়াজ শুনে গায়ের লোম খাড়া গিয়েছিল,6
169,মেয়েটা আমার পেটের উপরে বসে খেলা করত। পছন্দ করত এভাবে খেলা করতে।,positive,মেয়েটা পেটের খেলা করত পছন্দ করত এভাবে খেলা,8
170,আমি বেঁচে থাকতে সেটা মেনে নেব না।,negative,বেঁচে থাকতে মেনে নেব,4
171,"আমাকে পছন্দ করে না, যাই বলি, আমার সাথে ঝগড়া করে।",negative,পছন্দ যাই বলি ঝগড়া,4
172,বাবা ও বোনের মৃত্যু ওকে অনেক কষ্ট দিয়েছে,negative,বাবা বোনের মৃত্যু কষ্ট দিয়েছে,5
173,"আমি যাই, ওর জন্য ডিনারের ব্যবস্থা করি।",positive,যাই ডিনারের ব্যবস্থা,3
174,একটু টাকা লোভী। এখনই চলে আসবে।,positive,একটু টাকা লোভী এখনই আসবে,5
175,নাম রেখে তিনি মৃত্যুবরণ করেছিলেন,negative,নাম মৃত্যুবরণ,2
176,তুমি এখানে বসে বসে গল্প করছ!,positive,গল্প করছ,2
177,ছোটবেলায় বাবার কাছে শুনেছিলাম।,positive,ছোটবেলায় বাবার শুনেছিলাম,3
178,"লাল, হলুদ নাকি নীল রং এটা কোন বিষয় নয়।",positive,লাল হলুদ নীল রং বিষয়,5
179,"বাজে কথা না বলে, যা।",negative,বাজে,1
180,সে তোমাকে বোন ভাবে,positive,বোন,1
181,পিঠের ব্যাথাটা সারাতে হবে,negative,পিঠের ব্যাথাটা সারাতে,3
182,"যদিও সেই একই বনের পাখি, আর সেই একই মেঘের ঘনঘটা",positive,বনের পাখি মেঘের ঘনঘটা,4
183,"জীবনের চলার পথ, প্রকৃতিতে ঘেরা",positive,জীবনের চলার পথ প্রকৃতিতে ঘেরা,5
184,ওহে চাঁদের আলো রাঙ্গিয়ে দাও এই পথ,positive,ওহে চাঁদের আলো রাঙ্গিয়ে দাও পথ,6
185,এসো আমার নিশীত রজনীর সঙ্গী হয়ে,positive,এসো নিশীত রজনীর সঙ্গী,4
